{
  "$schema": "./plugin.schema.json",
  "name": "marc",
  "version": "26.10.14.1",
  "description": "mARC (Multi-Agent Relay Control) — an IRC/vaporwave-styled agent team plugin for Google Antigravity. @techlead operator + specialist bench.",
  "author": {
    "name": "NexaDuo"
  },
  "license": "MIT",
  "homepage": "https://github.com/NexaDuo/mARC",
  "repository": "https://github.com/NexaDuo/mARC"
}
